{
  "schema_version": "1.0",
  "audit_mode": "public",
  "run": {
    "run_id": "2026-10-26T1000-acme",
    "started_at": "2026-10-26T10:00:00Z",
    "finished_at": "2026-10-26T10:12:00Z",
    "collector_version": "1.0.0",
    "rubric_version": "1.0.0",
    "source_mode": "fixture",
    "synthetic": true
  },
  "business": {
    "name": "Acme Plumbing (synthetic)",
    "trade": "plumbing",
    "market": "Example County, CA",
    "place_id": "SYNTHETIC-PLACE-ACME-001",
    "website": "https://acme-plumbing.example/",
    "phone": "(555) 010-0200",
    "address": ""
  },
  "configuration": {
    "trade": "plumbing",
    "market": "Example County, CA",
    "service_business": true,
    "online_booking_expected": true,
    "messaging_expected": false,
    "emergency_service": true,
    "physical_storefront": false,
    "after_hours_expected": true,
    "content_posts_expected": false,
    "preferred_actions": [
      "call",
      "booking"
    ]
  },
  "sources": [
    {
      "id": "places",
      "type": "places_api",
      "collected_at": "2026-10-26T10:01:00Z",
      "collector_version": "1.0.0",
      "endpoint": "https://places.googleapis.com/v1/places/SYNTHETIC-PLACE-ACME-001",
      "field_completeness": 82
    },
    {
      "id": "destination",
      "type": "destination_http",
      "collected_at": "2026-10-26T10:04:00Z",
      "collector_version": "1.0.0",
      "endpoint": "https://acme-plumbing.example/",
      "field_completeness": 76
    },
    {
      "id": "public_profile",
      "type": "public_profile",
      "collected_at": "2026-10-26T10:06:00Z",
      "collector_version": "1.0.0",
      "field_completeness": 68
    },
    {
      "id": "reviews",
      "type": "review_sample",
      "collected_at": "2026-10-26T10:07:00Z",
      "collector_version": "1.0.0",
      "field_completeness": 64
    },
    {
      "id": "media",
      "type": "media_sample",
      "collected_at": "2026-10-26T10:08:00Z",
      "collector_version": "1.0.0",
      "field_completeness": 55
    }
  ],
  "profile": {
    "business_status": "OPERATIONAL",
    "name": "Acme Plumbing",
    "primary_category": "Plumber",
    "additional_categories": [
      "Drainage service",
      "Water heater repair"
    ],
    "description": "Plumbing repairs and drain cleaning for Example County homeowners. Same-day appointments when available.",
    "attributes": [],
    "regular_hours": [
      "Monday 07:00-19:00",
      "Tuesday 07:00-19:00",
      "Wednesday 07:00-19:00",
      "Thursday 07:00-19:00",
      "Friday 07:00-19:00",
      "Saturday 07:00-19:00",
      "Sunday closed"
    ],
    "location_mode": "service_area"
  },
  "actions": {
    "phone": {
      "present": true,
      "usable": true,
      "number": "(555) 010-0200"
    },
    "website": {
      "present": true,
      "usable": true,
      "url": "https://acme-plumbing.example/",
      "destination_state": "resolves"
    },
    "booking": {
      "present": false,
      "usable": false,
      "is_primary": false,
      "url": "",
      "destination_state": "missing"
    },
    "messaging": {
      "present": false,
      "usable": false,
      "url": ""
    },
    "directions": {
      "present": false,
      "usable": false,
      "url": ""
    },
    "other": {
      "present": true,
      "usable": true,
      "label": "Request an estimate on the website"
    }
  },
  "handoff": {
    "https": true,
    "resolves": true,
    "final_url": "https://acme-plumbing.example/",
    "identity_match": true,
    "destination_title": "Acme Plumbing \u2014 Example County",
    "notes": "Synthetic destination resolves. Mobile first viewport has no visible action."
  },
  "reviews": {
    "rating": 4.6,
    "count": 38,
    "owner_response_count": 0,
    "distribution": {
      "5": 25,
      "4": 8,
      "3": 3,
      "2": 1,
      "1": 1
    },
    "sample": [
      {
        "rating": 5,
        "published_at": "2026-07-18",
        "owner_response": false,
        "owner_response_at": null,
        "service_terms": [
          "drain cleaning"
        ]
      },
      {
        "rating": 5,
        "published_at": "2026-06-02",
        "owner_response": false,
        "service_terms": [],
        "owner_response_at": null
      },
      {
        "rating": 4,
        "published_at": "2026-02-14",
        "owner_response": false,
        "service_terms": [
          "water heater"
        ],
        "owner_response_at": null
      },
      {
        "rating": 2,
        "published_at": "2026-01-08",
        "owner_response": false,
        "owner_response_at": null,
        "service_terms": [
          "arrival window"
        ]
      },
      {
        "rating": 5,
        "published_at": "2025-11-20",
        "owner_response": false,
        "service_terms": [],
        "owner_response_at": null
      }
    ]
  },
  "media": {
    "count": 6,
    "business_owned_count": 2,
    "recent_count": 1,
    "categories": [
      "job_photo",
      "team_photo",
      "stock_graphic",
      "user_photo"
    ]
  },
  "measurement": {
    "website_source_parameter": null,
    "booking_source_parameter": null,
    "notes": "No observable profile-origin source parameter on the synthetic destination."
  },
  "facts": {
    "profile_status": "OPERATIONAL",
    "phone_action_usable": true,
    "website_action_usable": true,
    "booking_action_usable": false,
    "other_action_usable": true,
    "identity_consistent": true,
    "website_destination_state": "resolves",
    "booking_is_primary_action": false,
    "booking_destination_state": "missing"
  },
  "checks": {
    "GBP-ID-01": {
      "applicable": true,
      "score": 2,
      "confidence": "verified",
      "evidence": [
        "Places API: businessStatus=OPERATIONAL; displayName=Acme Plumbing matches the destination title."
      ],
      "evidence_refs": [
        "places",
        "destination"
      ],
      "needs_review": false
    },
    "GBP-ID-02": {
      "applicable": true,
      "score": 2,
      "confidence": "verified",
      "evidence": [
        "Places API primaryType=plumber; destination H1 names plumbing repair and drain service. The category is specific and accurate."
      ],
      "evidence_refs": [
        "places",
        "destination"
      ],
      "needs_review": false,
      "review": {
        "method": "model_judgment",
        "reviewer": "synthetic-fixture",
        "reviewed_at": "2026-10-26T10:15:00Z"
      }
    },
    "GBP-ID-03": {
      "applicable": true,
      "score": 1,
      "confidence": "strong_signal",
      "evidence": [
        "Places API types include plumber, drainage service, and water heater repair. Drainage is supported by the site; water-heater evidence is thin, so the set is not fully supported."
      ],
      "evidence_refs": [
        "places",
        "destination"
      ],
      "needs_review": false,
      "review": {
        "method": "model_judgment",
        "reviewer": "synthetic-fixture",
        "reviewed_at": "2026-10-26T10:15:00Z"
      }
    },
    "GBP-ID-04": {
      "applicable": true,
      "score": 2,
      "confidence": "verified",
      "evidence": [
        "Places API nationalPhoneNumber and destination tel: action both show (555) 010-0200."
      ],
      "evidence_refs": [
        "places",
        "destination"
      ],
      "needs_review": false
    },
    "GBP-ID-05": {
      "applicable": true,
      "score": 2,
      "confidence": "verified",
      "evidence": [
        "Places API websiteUri points to https://acme-plumbing.example/, the synthetic owned domain used throughout this fixture."
      ],
      "evidence_refs": [
        "places",
        "destination"
      ],
      "needs_review": false
    },
    "GBP-ID-06": {
      "applicable": true,
      "score": 2,
      "confidence": "verified",
      "evidence": [
        "Public profile and configuration: service-area business, no storefront address, Example County service area. The hidden address is correct, not a defect."
      ],
      "evidence_refs": [
        "public_profile",
        "places"
      ],
      "needs_review": false,
      "review": {
        "method": "model_judgment",
        "reviewer": "synthetic-fixture",
        "reviewed_at": "2026-10-26T10:15:00Z"
      }
    },
    "GBP-ID-07": {
      "applicable": true,
      "score": 1,
      "confidence": "verified",
      "evidence": [
        "Places API regularOpeningHours: Mon-Sat 07:00-19:00. The destination publishes the same window."
      ],
      "evidence_refs": [
        "places",
        "destination"
      ],
      "needs_review": false
    },
    "GBP-ID-08": {
      "applicable": true,
      "score": 1,
      "confidence": "strong_signal",
      "evidence": [
        "Profile description names repairs, drain cleaning, and Example County, but does not state a customer outcome or differentiator."
      ],
      "evidence_refs": [
        "public_profile"
      ],
      "needs_review": false,
      "review": {
        "method": "model_judgment",
        "reviewer": "synthetic-fixture",
        "reviewed_at": "2026-10-26T10:15:00Z"
      }
    },
    "GBP-ID-09": {
      "applicable": true,
      "score": 0,
      "confidence": "verified",
      "evidence": [
        "No service-specific attributes are visible on the public profile beyond the category labels. Financing and emergency attributes are absent."
      ],
      "evidence_refs": [
        "public_profile"
      ],
      "needs_review": false,
      "review": {
        "method": "model_judgment",
        "reviewer": "synthetic-fixture",
        "reviewed_at": "2026-10-26T10:15:00Z"
      }
    },
    "GBP-SVC-01": {
      "applicable": true,
      "score": 3,
      "confidence": "strong_signal",
      "evidence": [
        "Profile service list names drain cleaning and water-heater repair; the destination also sells leak detection and repiping. One major line is missing from the profile."
      ],
      "evidence_refs": [
        "places",